{
  "schemaVersion": "1.0.0",
  "changeEvidenceSchemaVersion": "1.0.0",
  "estimatorVersion": "change-seed/0.1.0\u002Bseed-rules/0.2.1",
  "sourceEstimatorVersion": "seed-rules/0.2.1",
  "repository": {
    "name": "repository:change-ts-package-a",
    "scope": ".",
    "ecosystems": [
      "javascript",
      "typescript"
    ],
    "sourceDigest": "sha256:78b4dd5982a2b008f5db3082b904fdb2b5ec59f9f66373da3e3667a93cce27a8"
  },
  "selection": {
    "schemaVersion": "1.0.0",
    "kind": "base-head",
    "base": {
      "selector": "fixture:change:ts-package-customization:base",
      "objectId": "0eee6e7d7ee01fe97236b360bb735bd0c56a0babd5d911d27ebbe94bbc26d3d6",
      "kind": "evidence"
    },
    "head": {
      "selector": "fixture:change:ts-package-customization:head",
      "objectId": "c81a815888d9568973df4bf43b1c804a9d905b787556d3eb0f6bf9598a5f0d7c",
      "kind": "evidence"
    }
  },
  "evidence": {
    "schemaVersion": "1.0.0",
    "selection": {
      "schemaVersion": "1.0.0",
      "kind": "base-head",
      "base": {
        "selector": "fixture:change:ts-package-customization:base",
        "objectId": "0eee6e7d7ee01fe97236b360bb735bd0c56a0babd5d911d27ebbe94bbc26d3d6",
        "kind": "evidence"
      },
      "head": {
        "selector": "fixture:change:ts-package-customization:head",
        "objectId": "c81a815888d9568973df4bf43b1c804a9d905b787556d3eb0f6bf9598a5f0d7c",
        "kind": "evidence"
      }
    },
    "repository": {
      "name": "repository:change-ts-package-a",
      "scope": ".",
      "ecosystems": [
        "javascript",
        "typescript"
      ],
      "sourceDigest": "sha256:78b4dd5982a2b008f5db3082b904fdb2b5ec59f9f66373da3e3667a93cce27a8"
    },
    "baseEvidenceDigest": "sha256:d213568cf452e8d79519fdd57ec4cbae2e406b9fa33345630f93fb619302a43b",
    "headEvidenceDigest": "sha256:78b4dd5982a2b008f5db3082b904fdb2b5ec59f9f66373da3e3667a93cce27a8",
    "unchangedContextPathCount": 2,
    "paths": [
      {
        "id": "change:path:3f186c87054a959bcd598740",
        "status": "added",
        "path": "src/retrying-pet-client.ts",
        "headObjectId": "d69e96a25444eb7d23c8901e4eb95c3a34e7b7043825028b0e891fb041236c90",
        "headBytes": 463,
        "editRegions": 1,
        "classification": "represented",
        "represented": true,
        "reason": "The final added artifact is maintained, non-mechanical change evidence.",
        "tags": [
          "classification:represented",
          "content:text",
          "ecosystem:typescript",
          "extension:.ts",
          "language:typescript",
          "role:source",
          "sha256:d69e96a25444eb7d23c8901e4eb95c3a34e7b7043825028b0e891fb041236c90",
          "status:added"
        ]
      }
    ],
    "diagnostics": [
      {
        "code": "FB4000",
        "severity": "information",
        "message": "The JavaScript/TypeScript analyzer parsed manifests, JSONC configuration, JavaScript/JSX syntax, and bounded TypeScript token streams statically; it did not run package managers, load executable configuration, install dependencies, transpile, or execute target code.",
        "evidenceIds": [],
        "locations": []
      }
    ]
  },
  "profile": "implementation",
  "baseline": {
    "id": "senior-contractor-2026-no-ai",
    "workerProfile": "Competent senior contractor familiar with the technical ecosystem",
    "technologyBaselineYear": 2026,
    "businessDomainFamiliar": false,
    "usesAi": false,
    "description": "One senior contractor recreating the described working system with modern 2026 tools and no AI."
  },
  "totalEffort": {
    "low": 1.25,
    "expected": 2.50,
    "high": 4.75
  },
  "categories": [
    {
      "category": "specification-comprehension-and-domain-learning",
      "hours": {
        "low": 0.25,
        "expected": 0.50,
        "high": 1
      }
    },
    {
      "category": "production-implementation",
      "hours": {
        "low": 0.75,
        "expected": 1.50,
        "high": 2.75
      }
    },
    {
      "category": "self-review-and-system-integration",
      "hours": {
        "low": 0.25,
        "expected": 0.50,
        "high": 1
      }
    }
  ],
  "workItems": [
    {
      "schemaVersion": "1.0.0",
      "id": "change-item:change-comprehension:e87c2bc7a37e20232b90",
      "category": "specification-comprehension-and-domain-learning",
      "title": "Understand the bounded change specification",
      "scope": ".",
      "evidenceIds": [
        "change:path:3f186c87054a959bcd598740"
      ],
      "quantity": 1,
      "complexity": "moderate",
      "hours": {
        "low": 0.25,
        "expected": 0.50,
        "high": 1
      },
      "confidence": 0.78,
      "reason": "Comprehend the final behavior and quality delta represented by the affected capability categories.",
      "estimator": {
        "id": "change-rule:change-comprehension",
        "version": "change-seed/0.1.0",
        "kind": "rule"
      },
      "profiles": [
        "implementation"
      ],
      "dependencyIds": [],
      "correlationGroup": "change:change-comprehension:.",
      "assumptions": [
        "The final base-to-head artifact delta is valued once with modern 2026-equivalent technology.",
        "Commit count, elapsed time, authorship, messages, and intermediate churn are not effort multipliers."
      ],
      "exclusions": [
        "Historical rework and discarded intermediate states are excluded."
      ],
      "uncertaintyReasons": []
    },
    {
      "schemaVersion": "1.0.0",
      "id": "change-item:capability-marginal:ddaba916cc806a9af879",
      "category": "production-implementation",
      "title": "Add Implement maintained internal logic for \u0027.\u0027 (package)",
      "scope": ".",
      "evidenceIds": [
        "change:path:3f186c87054a959bcd598740"
      ],
      "quantity": 1,
      "complexity": "high",
      "hours": {
        "low": 0.75,
        "expected": 1.50,
        "high": 2.75
      },
      "confidence": 0.67,
      "reason": "Positive base-to-head marginal effort from the existing repository capability model, bounded by touched final-change regions when existing behavior was also modified.",
      "estimator": {
        "id": "change-rule:capability-marginal",
        "version": "change-seed/0.1.0",
        "kind": "rule"
      },
      "profiles": [
        "implementation"
      ],
      "dependencyIds": [],
      "correlationGroup": "change:capability-marginal:.",
      "assumptions": [
        "The final base-to-head artifact delta is valued once with modern 2026-equivalent technology.",
        "Commit count, elapsed time, authorship, messages, and intermediate churn are not effort multipliers."
      ],
      "exclusions": [
        "Historical rework and discarded intermediate states are excluded."
      ],
      "uncertaintyReasons": [
        "Some TypeScript or fallback structure is token-backed rather than parser-backed."
      ]
    },
    {
      "schemaVersion": "1.0.0",
      "id": "change-item:change-review:106e78345f0c81c6d7fd",
      "category": "self-review-and-system-integration",
      "title": "Review and integrate the completed change",
      "scope": ".",
      "evidenceIds": [
        "change:path:3f186c87054a959bcd598740"
      ],
      "quantity": 1,
      "complexity": "moderate",
      "hours": {
        "low": 0.25,
        "expected": 0.50,
        "high": 1
      },
      "confidence": 0.8,
      "reason": "Review the coherent final delta and integrate its affected maintained artifacts; this is derived from final scope rather than commit count.",
      "estimator": {
        "id": "change-rule:change-review",
        "version": "change-seed/0.1.0",
        "kind": "rule"
      },
      "profiles": [
        "implementation"
      ],
      "dependencyIds": [],
      "correlationGroup": "change:change-review:.",
      "assumptions": [
        "The final base-to-head artifact delta is valued once with modern 2026-equivalent technology.",
        "Commit count, elapsed time, authorship, messages, and intermediate churn are not effort multipliers."
      ],
      "exclusions": [
        "Historical rework and discarded intermediate states are excluded."
      ],
      "uncertaintyReasons": []
    }
  ],
  "professionalizationGap": [],
  "reconciliation": {
    "isolatedComponentSum": {
      "low": 1.25,
      "expected": 2.50,
      "high": 4.75
    },
    "normalizedEffort": {
      "low": 1.25,
      "expected": 2.50,
      "high": 4.75
    },
    "additivityToleranceHours": 1,
    "expectedDifferenceHours": 0.00,
    "assessment": "within-no-rework-tolerance",
    "allocationMethod": "Proportional to isolated expected Change EHE with deterministic cent-level residual assignment; allocations are attribution, not historical hours.",
    "components": [
      {
        "id": "change-component:ca563de9c96786f9c472",
        "kind": "final-delta",
        "selector": "final-delta",
        "baseObjectId": "0eee6e7d7ee01fe97236b360bb735bd0c56a0babd5d911d27ebbe94bbc26d3d6",
        "headObjectId": "c81a815888d9568973df4bf43b1c804a9d905b787556d3eb0f6bf9598a5f0d7c",
        "isolatedEffort": {
          "low": 1.25,
          "expected": 2.50,
          "high": 4.75
        },
        "allocatedExpectedHours": 2.50,
        "evidenceIds": [
          "change:path:3f186c87054a959bcd598740"
        ]
      }
    ],
    "adjustments": []
  },
  "diagnostics": [
    {
      "code": "FB4000",
      "severity": "information",
      "message": "The JavaScript/TypeScript analyzer parsed manifests, JSONC configuration, JavaScript/JSX syntax, and bounded TypeScript token streams statically; it did not run package managers, load executable configuration, install dependencies, transpile, or execute target code.",
      "evidenceIds": [],
      "locations": []
    },
    {
      "code": "FB5000",
      "severity": "warning",